{
  "caseId": "ret-authorization-04",
  "expected": {
    "clarifications": [],
    "normalizedConcepts": [
      {
        "conceptId": "authorization",
        "ruleId": "taxonomy-active-alias",
        "sourceTermIds": [
          "ret-authorization-04-term-01"
        ]
      }
    ],
    "normalizedConstraints": [],
    "notices": [],
    "outcome": "normalized",
    "primaryFamily": "authorization",
    "unresolved": []
  },
  "normalizationGoldVersion": "retrieval-normalization-gold/1.0.0",
  "provenance": {
    "reviewReference": null,
    "reviewStatus": "not-reviewed",
    "reviewedAt": null,
    "reviewer": null,
    "status": "proposed"
  }
}
