{
  "caseId": "norm-rate-limiting-02",
  "expected": {
    "clarifications": [
      {
        "possibleConceptIds": [
          "concurrency-control",
          "rate-limiting"
        ],
        "reasonCode": "feature-scope-ambiguous",
        "sourceIds": [
          "norm-rate-limiting-02-term-01"
        ]
      },
      {
        "possibleConceptIds": [],
        "reasonCode": "primary-family-not-established",
        "sourceIds": [
          "norm-rate-limiting-02-term-01"
        ]
      }
    ],
    "normalizedConcepts": [],
    "normalizedConstraints": [],
    "notices": [],
    "outcome": "clarification-required",
    "primaryFamily": null,
    "unresolved": [
      {
        "blocking": true,
        "reasonCode": "feature-scope-ambiguous",
        "sourceIds": [
          "norm-rate-limiting-02-term-01"
        ]
      }
    ]
  },
  "normalizationGoldVersion": "retrieval-normalization-gold/1.0.0",
  "provenance": {
    "reviewReference": null,
    "reviewStatus": "not-reviewed",
    "reviewedAt": null,
    "reviewer": null,
    "status": "proposed"
  }
}
